{"artifact_kind":"nomination_selection","bundle":{"bundle_id":"nomination-7f935c30245fc1bb5048a80f302dc50431c0ef47ee623cb485a12c010e12777c","canonical_payload_sha256":"7f935c30245fc1bb5048a80f302dc50431c0ef47ee623cb485a12c010e12777c","file_sha256":"9bde1149ba8b4356c6b87b92d8dd0bd53a15a5639bac3f52aaab68b75d014986"},"reviewer_input":{"kind":"component","observation":{"authority":["test-owned component map"],"components":[{"component_id":"results","component_type":"artifact","elements":[{"element_id":"accuracy","evidence":[{"locator":"lines:1-1","observed":"Synthetic reviewer notes the descriptive context.","source":"evidence/context.txt"}],"target":"reported accuracy"}]}],"objective":"Provide a bounded structural authority for recorder tests.","scope":["focused evidence-bound recorder fixture"]}},"reviewer_label":"synthetic-example-not-authenticated","schema_version":"1.0","selections":[{"evidence_role":"supports","nomination_id":"hit-dec45e34c73443994d85538b9817df71d3afdbe8d754a1bf0cec36caa04807e8","observed_summary":"The stored sample reports accuracy 0.91.","rationale":"Synthetic reviewer selected the sample statement; no generalization is inferred."}]}
