{"artifact_kind":"nomination_selection","bundle":{"bundle_id":"nomination-49f67d2c1a22692aaa1a104905ab3c1ecc3eceebdb4bd78b7a5f99da9d2e78a5","canonical_payload_sha256":"49f67d2c1a22692aaa1a104905ab3c1ecc3eceebdb4bd78b7a5f99da9d2e78a5","file_sha256":"f07dc81c97021871c597dd40c2dd3482503b997e24c60d08ceba57129ac6afa8"},"reviewer_input":{"kind":"claim","record_input":{"authority":["synthetic fixture reviewer"],"bindings":[{"claim_id":"accuracy-reported","evidence_id":"sample-accuracy","role":"supports"}],"claims":[{"claim_id":"accuracy-reported","element_ref":{"component_id":"results","element_id":"accuracy"},"material":true,"rationale":"Synthetic reviewer matched the statement to the source line.","statement":"The stored sample reports accuracy 0.91.","status":"supported"}],"evidence_items":[{"evidence_id":"sample-accuracy","locator":{"end":1,"kind":"line_range","start":1},"method":"inspected","observed_summary":"The stored sample reports accuracy 0.91.","source":{"kind":"file","path":"evidence/support.txt"}}],"limitations":[],"objective":"Inspect a synthetic accuracy statement.","schema_version":"2.0","scope":["evidence/support.txt"],"summary":{"claim_boundary_ids":[],"no_supported_claim":false,"strongest_safe_claim_id":"accuracy-reported"},"unresolved_uncertainties":["Synthetic example does not establish held-out accuracy."]}},"reviewer_label":"synthetic-example-not-authenticated","schema_version":"1.0","selections":[{"evidence_id":"sample-accuracy","evidence_role":"supports","nomination_id":"hit-dec45e34c73443994d85538b9817df71d3afdbe8d754a1bf0cec36caa04807e8","observed_summary":"The stored sample reports accuracy 0.91.","rationale":"Synthetic reviewer selected the sample statement; no generalization is inferred."}]}
